,rating,date,variation,verified_reviews,feedback
1602,negative,29-Jul-18,Black  Show,returned repair repair done  problem requires defective part show sent repair got back without fixed   site gives option complain page echo spot works perfectly position ,0
1603,positive,29-Jul-18,Black  Show,love ,1
1604,positive,29-Jul-18,Black  Show,like design visuals ,1
1605,positive,29-Jul-18,Black  Show,show long used lot  love  use set timers cooking stove finicky wanting work time  also use check different recipes  listen music time favorite  telling everyone time dinner  son gets real kick know lot people expecting shows possible moment  remember original echo first came  see amazon adding new stuff time soon sure want soon  maybe even things thought wish bit user friendly  still figured video chat cousin north carolina also one  tried call son's dot went video chat immediately  last looked  dots video screens another thing needs addressed husband tried one bedroom play thunderstorm sounds help go sleep  tried get buy app instead playing skill enabled free  bit worried use  needs fixed say happy echo show ,1
1606,positive,29-Jul-18,White  Show,long  first alexa thing  sure like done far lot learn play,1
1607,positive,29-Jul-18,Black  Show,works great fun use ,1
1608,positive,29-Jul-18,White  Show,best echo devices spot dot echo,1
1609,positive,29-Jul-18,Black  Show,large screen really majes enjoyable experience  thing it’s missing youtube ,1
1610,positive,29-Jul-18,Black  Show,easy use ,1
1611,neutral,29-Jul-18,White  Show,bought go security camera system  perform like thought would  alert us someone door  also  can't talk person door echo show  cell phone ,1
1612,negative,29-Jul-18,Black  Show,great device  features awesome  interaction fantastic  home automation works perfect link accounts correctly  issue  4  echo shows  2  sent repair screen glitching  less 3 months old already issues first repairs sent  updated firmware  got device back nothing worked  update newest firmware work   2  weeks later glitch starts love show i’m getting really frustrated glitching ,0
1613,positive,29-Jul-18,Black  Show,super fun   ty expecting,1
1614,positive,29-Jul-18,Black  Show, ,1
1615,positive,29-Jul-18,White  Show,love much  alexa even better show things ,1
1616,positive,29-Jul-18,Black  Show,echo got 2 show  1 daughter  absolutely love  especially video chat ,1
1617,positive,29-Jul-18,Black  Show,i've alexa dot time i'm really enjoying alexa show  great visual whether song weather  played jeapordy  i'm good  learn trivia one's watching  love recipes visible movies available  long enough try everything ,1
1618,positive,29-Jul-18,Black  Show,got amazon prime ring pro  work really great  lazy guy need go see door anymore i'm gaming ,1
1619,positive,29-Jul-18,Black  Show,originally got show video chat family members  works great  found really like checking things hands free like weather recipes  far really liked show  would recommend ,1
1620,positive,29-Jul-18,Black  Show,easy setup  running minutes  learning feature outstanding  know amazon far ahead competition ,1
1621,negative,29-Jul-18,Black  Show,bought product hoping alexa would pretty well developed far enough along  therefore expecting responsive  $100 piece crap doesnt even know respond question amazon told ask   echo buttons manual  see step 3  device potential given big screen  decent sound 200 bucks  would never reccomend  even $100 spent  feel like got shorted  oh lastly  device pretty useless without prime membership  linked personal account thing literally decorated bluetooth speaker  went family account  one  got work minimal  oh  even prime membership  music pass something that's extra 3 99 month  leaving item subscription nightmare  overpriced  decorated bluetooth speaker eyes  would give zero stars could ,0
1622,positive,29-Jul-18,White  Show,quite nice clear  great sound ,1
1623,positive,29-Jul-18,Black  Show,versatile use  watch movies news   able use remote vehicle   use communication hub home   great produc ,1
1624,positive,29-Jul-18,Black  Show,bought two   one one daughter lives another state   love ,1
1625,negative,29-Jul-18,White  Show,family bought several help communicate older parents grandparents need simpler devices full fledged tablet   fantastic potential   digital photo screen  video calls  easy accesss music  audio books  etc  however  setup  discovered huge lurking negative   amazon forces view continous spam home screen promoting alexa features   turn many things settins  cannot turn  #34 things try #34   instead beautiful digital photo screen weather time   constantly spam ad across home screen says   #34 try  #34   amazon  please listen customers offer setting turn spam ,0
1626,positive,29-Jul-18,Black  Show,best part owning mother anti technology uses ease everyday finds new reasons use well  well done ,1
1627,positive,29-Jul-18,Black  Show,it’s second one  put one kitchen recipes ,1
1628,positive,29-Jul-18,White  Show,echo show perfect staging kitchen recipes right  need print  wonderful device  acoustical sounds powerful tall cylindercal echo covered adjacent family room ,1
1629,positive,29-Jul-18,Black  Show,great fun frustrating times  commands tv show get mixed  asking watch something turn directv  display show stinks 8 year old  also would like video options flash briefings  still really tech wonder low price ,1
1630,positive,29-Jul-18,Black  Show,love play music see lyrics   connected echo dot enjoy listening multiple rooms ,1
1631,neutral,29-Jul-18,Black  Show,love alexa chance add show home  jumped    i'm member show know paid extras echo  upstairs bedroom   supposed pay show added home  i'm afraid ask  #34 what's point #34 ,1
1632,positive,29-Jul-18,White  Show,purchased  #34 personal #34  contact vehicle engaging long distance grandchildren  works perfectly every regard  resolution sound better expected  highly recommend ,1
1633,positive,29-Jul-18,Black  Show,works well  pictures awesome  sound could better  must bandwidth alexa devices whole home music  2 4ghz vs 5ghz ,1
1634,positive,29-Jul-18,Black  Show,pleased echo show  sound music words tunes news weather  color screen photos could better ,1
1635,positive,29-Jul-18,White  Show,echo show personal assistant  awesome ,1
1636,positive,29-Jul-18,Black  Show,packaging beautiful  2 dots echo plus already  show love  echo room also say  #34 alexa  turn screen #34  go black  good sleeping ,1
1637,neutral,29-Jul-18,White  Show,ability respond accuracy variety information provided google search spoiled originally expected see type search engine echo  ability alexa provide detailed information part package perhaps improvements offing updates ,1
1638,positive,29-Jul-18,White  Show,daughter echo show told much loved  bought white one kitchen absolutely love   features others plus great extras  sound system awesome  also original echo tower  dots spot  great uses around house  highly recommend products ,1
1639,positive,29-Jul-18,Black  Show,really like show feature  also like video calls others ,1
1640,positive,29-Jul-18,Black  Show,love device   bought simple alarm clock amazon echo prime day price beat    sonos big ass fan lights able control device   perfect getting better time ,1
1641,positive,29-Jul-18,Black  Show,ase participating echo,1
1642,neutral,29-Jul-18,Black  Show,like weather options alexa search compacity needs improvement  aint google  alexa gets requests probably around 20  time  currently alexa youtube either  huge drawback echo show dropped price   international radio via tune awesome search engine  like pulling teeth get anything ,1
1643,positive,29-Jul-18,Black  Show,love ,1
1644,positive,29-Jul-18,Black  Show,love  still figured best things ,1
1645,positive,29-Jul-18,White  Show,easy use  answers questions hands free  what's like   may perfect  sign times come  connected smart home items  enjoy totallly  keeps home connected,1
1646,positive,29-Jul-18,Black  Show,product amazing  love  best buy  thing missing bluetooth,1
1647,positive,29-Jul-18,Black  Show,it’s great,1
1648,positive,29-Jul-18,Black  Show,echo show works great  enjoy  much ,1
1649,positive,29-Jul-18,Black  Show,works blink video cameras   work tube ,1
1650,positive,29-Jul-18,Black  Show,love simple set love fact answers questions bought one everybody family like jetsons,1
1651,positive,28-Jul-18,Black  Show,draw back stops every awhile middle song  ,1
1652,positive,28-Jul-18,Black  Show,great product ,1
1653,positive,28-Jul-18,Black  Show,echo teacher english  funny sometimes listen said ,1
1654,positive,28-Jul-18,Black  Show,ight,1
1655,positive,28-Jul-18,White  Show,awesome product  process every room house set automation show favorite device ,1
1656,positive,28-Jul-18,Black  Show,we’ve original echo quite time recently added show   simple setup inviting use visual interface   echo used primary interface connected home system currently controlling lights switches   look forward expanding capability   also use maintaining lists  music player  general information  entertainment   haven’t used show shuffle favorite  photographs start soon ,1
1657,positive,28-Jul-18,Black  Show,things great ,1
1658,positive,28-Jul-18,Black  Show,bought two  one kitchen sewing room  great need recipe need know something   still learning everything ,1
1659,positive,28-Jul-18,Black  Show,love shows song info screen playing  also time  notifications  news  etc ,1
1660,positive,28-Jul-18,Black  Show,alexa takes getting used  picture quality great  touch screen responsive smooth  speakers better expected wellfour stars five,1
1661,positive,28-Jul-18,White  Show,love,1
1662,neutral,28-Jul-18,White  Show,like option white  it’s bizarre comes black cord  white kitchen  stands like sore thumb black power cord  aesthetic purposes  happier year old white echo  show  came white powercord  seems like major design flaw  white  option  strongly urge amazon change powercord white ,1
1663,positive,28-Jul-18,Black  Show,pleased echo show  love many nice features  highly recommend ,1
1664,positive,28-Jul-18,Black  Show,ease set overall functionality makes echo show worth every penny   especially like setting background screen able set affirmations use personalized reminders ,1
1665,positive,28-Jul-18,Black  Show,love   wanted primarily kitchen   addition common services wanted use allrecipes cook's illustrated recipes,1
1666,positive,28-Jul-18,Black  Show,easy use  great recipes  listen music  see movies  movie trailers  much ,1
1667,positive,28-Jul-18,Black  Show,love able see information alexa gives   notifications turned lets know order delivered also tells order  use echo screen pull details orders  use alexa skill make calls uhyour echo ,1
1668,positive,28-Jul-18,White  Show,great sound video ,1
1669,positive,28-Jul-18,Black  Show,really like ,1
1670,positive,28-Jul-18,White  Show,love echo show  listen music  get recipes  much  highly recommend echo everyone ,1
1671,positive,28-Jul-18,Black  Show,easy set  plug make selections preferences language  temp c f etc  getting familiar adding calendar appointments ,1
1672,positive,28-Jul-18,Black  Show,like variety stuff echo show offers ,1
1673,positive,28-Jul-18,Black  Show,love ,1
1674,positive,28-Jul-18,Black  Show,wish internet searches   like feature,1
1675,positive,28-Jul-18,Black  Show,bought visiting friend one great   understand frustration youtube though   still good love seeing words songs ring doorbell never get chair laziness best   lol   great product good speakers ,1
1676,positive,28-Jul-18,White  Show,good smart home gadget ,1
1677,positive,28-Jul-18,Black  Show,love speakers screen ,1
1678,negative,28-Jul-18,White  Show,youtube,0
1679,positive,28-Jul-18,Black  Show,loved everything item  quick response time sensitive speaking end house ,1
1680,positive,28-Jul-18,Black  Show,bought mother,1
1681,positive,28-Jul-18,Black  Show,great  would better way use headphones ,1
1682,positive,28-Jul-18,White  Show,far good   much better sound echo dot,1
1683,positive,28-Jul-18,Black  Show,clear screen great picture,1
1684,positive,28-Jul-18,Black  Show,love  compatible many cameras everything echo dot ,1
1685,positive,28-Jul-18,Black  Show,kitchen  great news music  video call daughter grand kids  really dig ,1
1686,positive,28-Jul-18,Black  Show,absolutely love thing  love amazon echo show went bonkers took brief chat voila  new one replace way  floored screen started blurring shaking jumping missing part data  alexa still talked watch movies  happy amazon easy deal makes good products without hassle ,1
1687,positive,28-Jul-18,Black  Show,works well recipes references  nice device  right size ,1
1688,positive,28-Jul-18,Black  Show,works well,1
1689,negative,28-Jul-18,White  Show,works fine  realize don’t need don’t use ,0
1690,positive,28-Jul-18,Black  Show,screen  microphones  speaker  alexa lives inside   yup echo show   expectations met ,1
1691,positive,28-Jul-18,Black  Show,user friendly,1
1692,positive,28-Jul-18,Black  Show, ,1
1693,positive,28-Jul-18,Black  Show,let’s start dislikes  want buy 7 house even need add likes  hahaawesome fun useful  nothing else say ,1
1694,positive,28-Jul-18,White  Show,outstanding piece technology  use everyday information  scheduling general information   awesome amazon  keep improving ai ,1
1695,positive,28-Jul-18,Black  Show,impulse buy super happy made purchase  love much immediately bought parents one  video chat easily  love features easy use set ,1
1696,positive,28-Jul-18,Black  Show,like,1
1697,positive,28-Jul-18,Black  Show,great product  great price prime day   thanks alexa ,1
1698,positive,28-Jul-18,Black  Show,still trying figure link bluetooth speaker ,1
1699,positive,28-Jul-18,Black  Show,wish skills,1
1700,positive,28-Jul-18,Black  Show,still learning  started integrating smart devices home echo product line  show  spot  two dots kids dot  trouble getting call still working ,1
1701,positive,28-Jul-18,Black  Show,great improvement original echo   like ability see lyrics songs  watch prime tv get visuals   little hints things try appears across bottom sparks imagination ,1
1702,positive,28-Jul-18,White  Show,love ,1
1703,positive,28-Jul-18,Black  Show,sound great video great  need learn everything  see videos  youtube  listen music  watch news,1
1704,positive,28-Jul-18,White  Show,great addition alexa family  great video also ,1
1705,neutral,28-Jul-18,Black  Show,belong amazon prime  would think could watch video library   prime music,1
1706,positive,28-Jul-18,Black  Show,starting day ,1
1707,positive,28-Jul-18,Black  Show,nothing dislike lot expected,1
1708,positive,28-Jul-18,Black  Show,bought specifically wife could look arlo security cameras bedroom i’m work  system worked three days gives error message  disappointed due fact advertise systems work together  gave four stars everything else well ,1
1709,positive,28-Jul-18,Black  Show,love,1
1710,positive,28-Jul-18,Black  Show,awesome  love able turn lights don’t walk dark home  also get video chat nephews live states away asking alexa call ,1
1711,positive,28-Jul-18,White  Show,super easy set  great features  fun ,1
1712,positive,28-Jul-18,Black  Show,love size videos good quality   sound awesome ,1
1713,positive,28-Jul-18,Black  Show,home,1
1714,positive,28-Jul-18,White  Show,bought older grandparent help reminders  would recommend anyone someone life dementia memory loss  helps grandmother remember take medications daily task  loves listen music ask questions,1
1715,positive,28-Jul-18,Black  Show,kids like games   showing lyrics songs neat ,1
1716,negative,28-Jul-18,Black  Show,need able connect 3rd party viceo apps,0
1717,positive,28-Jul-18,Black  Show,glad upgraded aka,1
1718,positive,28-Jul-18,Black  Show,still leaning  price right ,1
1719,positive,28-Jul-18,Black  Show,two dots  tap show  love echo show  sound quality amazing compared dots  use mine constantly create shopping list  kitchen laundry timer  news updates  throughout house play music throughout using group settings,1
1720,positive,28-Jul-18,Black  Show,absolutely love show ,1
1721,positive,28-Jul-18,White  Show,echo show   white nbsp great new addition alexa home solution call back home video chat directly phone  great way stay touch family ,1
1722,neutral,28-Jul-18,Black  Show,echo screen  hence still needs work  considering google home ,1
1723,positive,28-Jul-18,Black  Show,great product,1
1724,positive,28-Jul-18,White  Show,like fact messages visual well audible puzzled light make  quot notification quot  sound ask alexa read notifications  tells new notifications   happened least day week ,1
1725,positive,28-Jul-18,White  Show,loved alexa whole new level  love  fun watch movie trailers  weather much complete  listen music lyrics appear  still discovering echo show  highly recommend  takes alexa completely new world ,1
1726,neutral,28-Jul-18,Black  Show,nice product intelligent thought hoped ,1
1727,negative,28-Jul-18,White  Show,tech isn’t  doesn’t understand common words basically glorified radio,0
1728,positive,28-Jul-18,Black  Show, ,1
1729,positive,28-Jul-18,White  Show,love   echoes love bought prime day   regrets   love connect ring see front door   yhe kids like seeing lyrics songs sing along   ,1
1730,positive,28-Jul-18,Black  Show,love  plays great music  movies  much  lag u want see arlo security cameras thou  far good  wish longer cord ,1
1731,positive,28-Jul-18,Black  Show,love echo show  video quality good course sound good ,1
1732,positive,28-Jul-18,Black  Show,love  kitchen watch prime video cooking ,1
1733,positive,28-Jul-18,Black  Show,love ,1
1734,positive,28-Jul-18,Black  Show,great product,1
1735,positive,28-Jul-18,Black  Show,pleased item  display clean crisp easy read  enjoy trying suggested things try asking alexa  use timer feature quite bit added calendars contacts  still exploring many skills available ,1
1736,positive,28-Jul-18,White  Show,device great speakers screen quality phenomenal ,1
1737,positive,28-Jul-18,Black  Show,dot  spot  echo show love show spot best  show great sound wife loves display weather  recipes sing alongside  super deal ,1
1738,neutral,28-Jul-18,Black  Show,doesn’t play tube videos,1
1739,neutral,28-Jul-18,Black  Show,working great  til 1 week algo    month  started flickering   support forums say known isue   4 months reported soluci n ,1
1740,positive,28-Jul-18,White  Show,like video calling feature  got contact elderly parents works well,1
1741,negative,28-Jul-18,White  Show,sound terrible  it’s like tin  love echo item awful ,0
1742,positive,28-Jul-18,Black  Show,waiting echo show go sale worth wait  easy set start using,1
1743,positive,28-Jul-18,Black  Show,bought prime day,1
1744,negative,28-Jul-18,Black  Show,4th echo device  1st echo show  seemed huge potential  really wanted like  soon found quite limited  bit disappointing  end world  used like use  screenless echos  little 2 month  screen started flickering  mostly bottom screen  quick look forums made understand pointless asking replacement  people 2 3 devices replaced  start flickering shortly  amazon providing serious answers  going quite time apparently long story short  moved hallway  using expensive  bulky voice activated light switch hue lights  like headline suggests  meh ,0
1745,positive,28-Jul-18,Black  Show,love play music works great finding recipes  need family adapted machines see,1
1746,positive,28-Jul-18,Black  Show,seems little less intuitive regular echo plus  also little harder pick saying   combined four household  speak loud enough hear cross activating ones  rename one   overall works well  seem adept things original echo plus ,1
1747,positive,28-Jul-18,Black  Show,second show   like much   use mine music arlo security cameras   connect display outdoor cameras voice  exceptionally capable devices   highly recommend ,1
1748,positive,28-Jul-18,Black  Show,love seeing everything display ,1
1749,positive,28-Jul-18,Black  Show,love thing   enjoy watching daily news  play music lyrics  songs  ordering coffee etc,1
1750,positive,31-Jul-18,Black  Plus,use alexa primarily listening music checking weather  still learning ways use  everything ready hands free far  speaker great volume sound ,1
1751,positive,31-Jul-18,Black  Plus,plug n play set simple  added battery base make portable  looking forward using hub ,1
1752,positive,30-Jul-18,White  Plus,great speaker n  love much alexa tap  it’s definitely fast response much prettier,1
1753,positive,30-Jul-18,Black  Plus, alexa  bit dense still learning way phrase things ny nj regional accent ,1
1754,positive,30-Jul-18,Black  Plus,great sound easy set  purchased echo plus built hub would make easier connect devices  hooked alexa ,1
1755,positive,30-Jul-18,White  Plus,like built hub  plus unit sounds great  wish volume control ,1
1756,positive,30-Jul-18,White  Plus,happy echo plus  fun learning ,1
1757,positive,30-Jul-18,Black  Plus,love new echo plus,1
1758,positive,30-Jul-18,Black  Plus,omg love ,1
1759,positive,30-Jul-18,White  Plus,around week  love control items house even i’m  makes feel better away house people don’t know gone  alexa disappointed ,1
1760,positive,30-Jul-18,White  Plus,know needed plugged work  far experiences positive ,1
1761,positive,30-Jul-18,Black  Plus, ,1
1762,positive,30-Jul-18,Black  Plus,surprised learn used bluetooth speaker phones tablets  probably lists description  missed part   quite surround like quality bluetooth speaker $100  range  good none less   even basic access amazon music lot listen   there's huge number things alexa  learning every day ,1
1763,positive,30-Jul-18,Black  Plus,fun use  love novelty gadgets  alexa really works well ,1
1764,negative,30-Jul-18,Black  Plus, ,0
1765,positive,30-Jul-18,White  Plus,awesome device home   full useful information   us e phone answer spur moment questions ,1
1766,positive,30-Jul-18,Black  Plus,like echo plus wonderful least thing like turn every,1
1767,positive,30-Jul-18,Black  Plus,love echo plus  like listening music sound great  features nice  wish wireless could listen music outside ,1
1768,positive,30-Jul-18,Black  Plus,it’s great product easily set get sync personal set,1
1769,positive,30-Jul-18,Black  Plus,using hub music ,1
1770,neutral,30-Jul-18,Black  Plus,still need ai built interact better  needs continue conversation sometimes finding   answer needs right  can't keep stop alexa ask  also  able access wikipedia  dictionary many areas better fast access needs hear us better  also  able name instead calling alexa echo  price reduced bit  value based  updates auto daily improve   connectivity home equipment imrproved well good product good sound quality  needs ai built ,1
1771,positive,30-Jul-18,White  Plus,excellent purchase  echo plus sound quality  good size  love  ,1
1772,positive,30-Jul-18,Black  Plus,take 6 hours set galaxy s9 phone got used system setup seconds edit light bulbs adding string lights simple easy,1
1773,positive,30-Jul-18,Black  Plus,great speaker  great microphone response   loving purchase beginning smart home ,1
1774,positive,30-Jul-18,Black  Plus,3rd echo built hub works great    echo family room  bedroom home office ,1
1775,neutral,30-Jul-18,White  Plus,don'r know use yet   need explicit directions electeonically challenged   get feee lifht bulb part package ,1
1776,positive,30-Jul-18,Black  Plus,amazing 3 love,1
1777,positive,30-Jul-18,Black  Plus,awesome product  responsive alexa needs content variety comes music  uses bing search engine instead google  two could combine  would perfect product ,1
1778,positive,30-Jul-18,Black  Plus,pleasantly surprised accuracy alexa  unit responsive easily respond even tv music playing pair two smart  bulbs go  dim ease using voice app  fidelity good size regret would liked silver model fabric cover unimportant issue ,1
1779,positive,30-Jul-18,Black  Plus,went best buy intention buying alexa products  instead talked google home products  bought google home home mini  trouble start setting  couldn’t understand husband  scottish accent  days  oops  something went wrong  command  returned bought amazon echo show echo plus  easy set  connected immediately amazon account way easier navigate  understand commands husband first try yet give error message  loved two products gone intended first place  won’t regret purchase ,1
1780,positive,30-Jul-18,Black  Plus,tons features skills  good speaker plenty bass music  still need work ai  responding random questions though  android phone far better  echo still get lot  #34 hmm  i'm sure #34   #34 opinion #34 ,1
1781,positive,30-Jul-18,Black  Plus,like alexa,1
1782,positive,30-Jul-18,Black  Plus,far fun use learn deal alexa  still learning finding really done  plus process making house smart house  much control alexa yet ,1
1783,positive,30-Jul-18,Black  Plus,like whole thing far,1
1784,positive,30-Jul-18,Black  Plus,specs regular echo  easier use getting separate hub smart lights  etc ,1
1785,positive,30-Jul-18,Black  Plus,great product many good aspects  easy setup control intuitive straight forward instructions  included lightbulb excellent worked perfectly  much enjoy product recommend ,1
1786,positive,30-Jul-18,Black  Plus,much different one   alexa still stubborn  lol   ordered prime day get light bulbs deal get light bulbs   called said sold   felt bad   buy light bulbs ,1
1787,positive,30-Jul-18,Black  Plus,ability play amazon music outside patio gatherings  also used blue tooth connect echo plus via alexa app tablet external speaker party extends yard  plans connect devices thermostat lighting home devices ,1
